{
  "patientName": "Jane Doe",
  "dateOfBirth": "1985-02-15",
  "bloodType": "A+",
  "allergies": ["Pollen", "Penicillin"],
  "conditions": ["Hypertension", "Diabetes"],
  "medications": ["Lisinopril", "Metformin"],
  "emergencyContact": {
    "username": "emergencyuser",
    "email": "emergency@example.com"
  }
}
